{
  "logoUrl": "https://upload.wikimedia.org/wikipedia/commons/a/a7/React-icon.svg",
  "invoiceNumber": "INV-000123",
  "formattedDate": "17 Aug 2026",
  "formattedTime": "14:32",
  "dueDate": "",
  "cashierName": "Nimal Perera",
  "status": "paid",
  "isCredit": false,
  "copyDesignation": "ORIGINAL — CUSTOMER COPY",
  "isDuplicate": false,
  "customerName": "Kasun Silva",
  "customerPhone": "077 123 4567",
  "customerAddress": "45 Lake Road, Colombo 06",
  "paymentMethod": "cash",
  "cardLast4": "",
  "tenderedAmountCents": 1200000,
  "items": [
    {
      "name": "Screen Protector - iPhone 14",
      "sku": "ACC-SP-014",
      "quantity": 2,
      "unitPriceCents": 150000,
      "discountCents": 0,
      "totalCents": 300000
    },
    {
      "name": "Screen Replacement",
      "sourceTicketNumber": "REP-000045",
      "assignedEmployeeName": "Ruwan Fernando",
      "quantity": 1,
      "unitPriceCents": 850000,
      "discountCents": 50000,
      "totalCents": 800000
    }
  ],
  "subtotalCents": 1100000,
  "discountCents": 0,
  "taxCents": 0,
  "totalCents": 1100000,
  "vatRatePercent": 0,
  "amountInWords": "Eleven Thousand Rupees Only",
  "notes": "",
  "warrantyText": "All repairs carry a 30-day warranty on parts and labor. Warranty does not cover physical or liquid damage occurring after repair.",
  "showBankDetails": false,
  "bankName": "",
  "bankBranch": "",
  "accountName": "",
  "accountNumber": "",
  "shopTradingName": "TechFix Repairs",
  "shopLegalName": "TechFix Repairs (Pvt) Ltd",
  "shopEmail": "info@techfixrepairs.lk",
  "shopWebsite": "techfixrepairs.lk",
  "shopBusinessRegNo": "PV 00123456",
  "shopVatNo": "",
  "shopIsVatRegistered": false,
  "shopAddressLines": ["123 Galle Road", "Colombo 04"],
  "shopPrimaryPhone": "011 234 5678",
  "shopSecondaryPhone": ""
}
